ord,leg,ymd,mov,n,member,id,committee,party,rank,note
1264,64,20181009,alta,15,MANUEL HUERTA MARTINEZ,rp4-34p,pueblos indigenas,morena,integrante,
1265,64,20181009,alta,16,DELFINO LOPEZ APARICIO,mex25p,pueblos indigenas,morena,integrante,
1266,64,20181009,alta,17,VIRGINIA MERINO GARCIA,rp3-27s,pueblos indigenas,morena,integrante,
1267,64,20181009,alta,18,ARACELI OCAMPO MANZANARES,gue02p,pueblos indigenas,morena,integrante,
1268,64,20181009,alta,19,INES PARRA JUAREZ,pue04p,pueblos indigenas,morena,integrante,
1269,64,20181009,alta,20,BEATRIZ DOMINGA PEREZ LOPEZ,oax06p,pueblos indigenas,morena,integrante,
1270,64,20181009,alta,21,ALEJANDRO PONCE COBOS,rp3-22p,pueblos indigenas,morena,integrante,
1271,64,20181009,alta,22,MARCO ANTONIO REYES COLIN,mex40p,pueblos indigenas,morena,integrante,
1272,64,20181009,alta,23,LUCINDA SANDOVAL SOBERANES,rp1-35p,pueblos indigenas,morena,integrante,
1273,64,20181009,alta,24,MARIA DE LOS ANGELES GUTIERREZ VALDEZ,cua09p,pueblos indigenas,pan,integrante,
1274,64,20181009,alta,25,CARLOS ALBERTO VALENZUELA GONZALEZ,rp3-02p,pueblos indigenas,pan,integrante,
1275,64,20181009,alta,26,DULCE ALEJANDRA GARCIA MORLAN,rp3-07p,pueblos indigenas,pan,integrante,
1276,64,20181009,alta,27,FRINNE AZUARA YARZABAL,rp2-18p,pueblos indigenas,pri,integrante,
1277,64,20181009,alta,28,JUAN JOSE CANUL PEREZ,yuc05p,pueblos indigenas,pri,integrante,
1278,64,20181009,alta,29,MIGUEL ACUNDO GONZALEZ,pue01p,pueblos indigenas,pes,integrante,
1279,64,20181009,alta,30,JAVIER JULIAN CASTAÑEDA POMPOSO,bc06p,pueblos indigenas,pes,integrante,
1280,64,20181009,alta,31,MARGARITA GARCIA GARCIA,oax03p,pueblos indigenas,pt,integrante,
1281,64,20181009,alta,32,JUAN MARTIN ESPINOZA CARDENAS,jal17p,pueblos indigenas,mc,integrante,
1282,64,20181009,alta,33,ARIEL RODRIGUEZ VAZQUEZ,gua01p,pueblos indigenas,mc,integrante,
1283,64,20181217,baja,6,LAURA LETICIA MENDEZ REYES,rp3-03s,pueblos indigenas,pan,secretario,
1284,64,20181217,alta,6,ANTONIA NATIVIDAD DIAZ JIMENEZ,rp3-03p,pueblos indigenas,pan,secretario,
1285,64,20190118,baja,11,ROGELIO RAYO MARTINEZ,cps11s,pueblos indigenas,pvem,secretario,
1286,64,20190123,alta,11,ROBERTO ANTONIO RUBIO MONTEJO,cps11p,pueblos indigenas,pvem,secretario,
1287,64,20190402,baja,10,RAYMUNDO GARCIA GUTIERREZ,gue06p,pueblos indigenas,prd,secretario,
1288,64,20190402,alta,10,RAYMUNDO GARCIA GUTIERREZ,gue06p,pueblos indigenas,prd,integrante,
1289,64,20181009,alta,1,MIROSLAVA CARRILLO MARTINEZ,mex34p,puntos constitucionales,morena,presidente,
1290,64,20181009,alta,2,GUSTAVO CONTRERAS MONTES,mex08p,puntos constitucionales,morena,secretario,
1291,64,20181009,alta,3,HORACIO DUARTE OLIVARES,rp5-28p,puntos constitucionales,morena,secretario,
1292,64,20181009,alta,4,HECTOR GUILLERMO DE JESUS JIMENEZ Y MENESES,pue13p,puntos constitucionales,morena,secretario,
1293,64,20181009,alta,5,IVAN ARTURO RODRIGUEZ RIVERA,rp5-01p,puntos constitucionales,pan,secretario,
1294,64,20181009,alta,6,JOSE ELIAS LIXA ABIMERHI,yuc04p,puntos constitucionales,pan,secretario,
1295,64,20181009,alta,7,MARIA ALEMAN MUÑOZ CASTILLO,rp2-20p,puntos constitucionales,pri,secretario,
1296,64,20181009,alta,8,IVAN ARTURO PEREZ NEGRON RUIZ,mic10p,puntos constitucionales,pes,secretario,
1297,64,20181009,alta,9,SILVANO GARAY ULLOA,rp3-18s,puntos constitucionales,pt,secretario,
1298,64,20181009,alta,10,ADRIANA GABRIELA MEDINA ORTIZ,jal12p,puntos constitucionales,mc,secretario,
1299,64,20181009,alta,11,JAVIER SALINAS NARVAEZ,rp5-17p,puntos constitucionales,prd,secretario,
1300,64,20181009,alta,12,ESTEBAN BARAJAS BARAJAS,mic02p,puntos constitucionales,morena,integrante,
1301,64,20181009,alta,13,LIDIA GARCIA ANAYA,hgo06p,puntos constitucionales,morena,integrante,
1302,64,20181009,alta,14,PABLO GOMEZ ALVAREZ,df23p,puntos constitucionales,morena,integrante,
1303,64,20181009,alta,15,ERASMO GONZALEZ ROBLEDO,tam07p,puntos constitucionales,morena,integrante,
1304,64,20181009,alta,16,MARIA BEATRIZ LOPEZ CHAVEZ,rp4-22p,puntos constitucionales,morena,integrante,
1305,64,20181009,alta,17,FLOR IVONE MORALES MIRANDA,df21p,puntos constitucionales,morena,integrante,
1306,64,20181009,alta,18,DAVID ORIHUELA NAVA,mex23p,puntos constitucionales,morena,integrante,
1307,64,20181009,alta,19,LUCIO ERNESTO PALACIOS CORDERO,rp4-28p,puntos constitucionales,morena,integrante,
1308,64,20181009,alta,20,MARTHA PATRICIA RAMIREZ LUCERO,rp1-39p,puntos constitucionales,morena,integrante,
1309,64,20181009,alta,21,PAOLA TENORIO ADAME,ver19p,puntos constitucionales,morena,integrante,
1310,64,20181009,alta,22,ROSALBA VALENCIA CRUZ,rp3-35p,puntos constitucionales,morena,integrante,
1311,64,20181009,alta,23,ALEJANDRO VIEDMA VELAZQUEZ,rp5-40p,puntos constitucionales,morena,integrante,
1312,64,20181009,alta,24,EDGAR GUZMAN VALDEZ,pue07p,puntos constitucionales,morena,integrante,
1313,64,20181009,alta,25,RAUL GRACIA GUZMAN,rp2-01p,puntos constitucionales,pan,integrante,
1314,64,20181009,alta,26,MARCOS AGUILAR VEGA,rp2-05p,puntos constitucionales,pri,integrante,
1315,64,20181009,alta,27,RICARDO VILLARREAL GARCIA,gua02p,puntos constitucionales,pes,integrante,
1316,64,20181009,alta,28,CRUZ JUVENAL ROA SANCHEZ,mex36p,puntos constitucionales,pt,integrante,
1317,64,20181009,alta,29,CLAUDIA PASTOR BADILLA,rp4-13p,puntos constitucionales,pri,integrante,
1318,64,20181009,alta,30,ESMERALDA DE LOS ANGELES MORENO MEDINA,mex26p,puntos constitucionales,pes,integrante,
1319,64,20181009,alta,31,JOSE GERARDO RODOLFO FERNANDEZ NOROÑA,df04p,puntos constitucionales,pt,integrante,
1320,64,20181009,alta,32,MARTHA ANGELICA TAGLE MARTINEZ,rp4-21p,puntos constitucionales,mc,integrante,
1321,64,20181009,alta,33,ARTURO ESCOBAR Y VEGA,rp4-19p,puntos constitucionales,pvem,integrante,
1322,64,20181018,baja,31,JOSE GERARDO RODOLFO FERNANDEZ NOROÑA,df04p,puntos constitucionales,pt,integrante,
1323,64,20181018,alta,31,ANA RUTH GARCIA GRANDE,bcs01p,puntos constitucionales,pt,integrante,
1324,64,20181120,baja,12,ESTEBAN BARAJAS BARAJAS,mic02p,puntos constitucionales,morena,integrante,
1325,64,20181120,alta,12,ESTEBAN BARAJAS BARAJAS,mic02p,puntos constitucionales,morena,secretario,
1326,64,20181205,baja,3,HORACIO DUARTE OLIVARES,rp5-28p,puntos constitucionales,morena,secretario,
1327,64,20181205,alta,3,SERGIO CARLOS GUTIERREZ LUNA,rp5-28s,puntos constitucionales,morena,secretario,
1328,64,20190115,baja,33,ARTURO ESCOBAR Y VEGA,rp4-19p,puntos constitucionales,pvem,integrante,
1329,64,20190115,alta,33,MARCO ANTONIO GOMEZ ALCANTAR,rp1-19p,puntos constitucionales,pvem,integrante,
1330,64,20190115,baja,6,JOSE ELIAS LIXA ABIMERHI,yuc04p,puntos constitucionales,pan,secretario,
1331,64,20190120,alta,6,MARIO EMMANUEL ARAGON CASTILLO,yuc04s,puntos constitucionales,pan,secretario,
1332,64,20190117,alta,6,JOSE ELIAS LIXA ABIMERHI,yuc04p,puntos constitucionales,pan,secretario,
1333,64,20190211,baja,16,MARIA BEATRIZ LOPEZ CHAVEZ,rp4-22p,puntos constitucionales,morena,integrante,
1334,64,20190211,alta,16,JOSE GUILLERMO ARECHIGA SANTAMARIA,pue09p,puntos constitucionales,morena,integrante,
1335,64,20190408,alta,?,VERONICA BEATRIZ JUAREZ PIÑA,rp1-17p,puntos constitucionales,prd,integrante,
1336,64,20190412,baja,16,JOSE GUILLERMO ARECHIGA SANTAMARIA,pue09p,puntos constitucionales,morena,integrante,
1337,64,20190412,alta,16,JAVIER ARIEL HIDALGO PONCE,df10p,puntos constitucionales,morena,integrante,
1338,64,20190426,baja,31,ANA RUTH GARCIA GRANDE,bcs01p,puntos constitucionales,pt,integrante,
1339,64,20190426,alta,31,ANA KARINA ROJO PIMENTEL,df20p,puntos constitucionales,pt,integrante,
1340,64,20181009,alta,1,LAURA ANGELICA ROJAS HERNANDEZ,rp5-02p,radio y television,pan,presidente,
1341,64,20181009,alta,2,LETICIA ARLETT AGUILAR MOLINA,cps09p,radio y television,morena,secretario,
1342,64,20181009,alta,3,SERGIO PEREZ HERNANDEZ,rp5-30p,radio y television,morena,secretario,
1343,64,20181009,alta,4,ERIKA MARIANA ROSAS URIBE,rp1-18p,radio y television,morena,secretario,
1344,64,20181009,alta,5,RAFAEL HERNANDEZ VILLALPANDO,ver10p,radio y television,morena,secretario,
1345,64,20181009,alta,6,CARLOS HUMBERTO CASTAÑOS VALENZUELA,rp1-08p,radio y television,pan,secretario,
1346,64,20181009,alta,7,OSCAR DANIEL MARTINEZ TERRAZAS,rp4-08p,radio y television,pan,secretario,
1347,64,20181009,alta,8,FERNANDO DONATO DE LAS FUENTES HERNANDEZ,coa07p,radio y television,pri,secretario,
1348,64,20181009,alta,9,NAYELI SALVATORI BOJALIL,pue10p,radio y television,pes,secretario,
1349,64,20181009,alta,10,HECTOR SERRANO CORTES,rp4-15p,radio y television,prd,secretario,
1350,64,20181009,alta,11,LUIS JAVIER ALEGRE SALAZAR,rp3-30p,radio y television,morena,integrante,
1351,64,20181009,alta,12,MARIO ISMAEL MORENO GIL,bc05p,radio y television,morena,integrante,
1352,64,20181009,alta,13,OSCAR RAFAEL NOVELLA MACIAS,rp2-29p,radio y television,morena,integrante,
1353,64,20181009,alta,14,SANDRA SIMEY OLVERA BAUTISTA,hgo03p,radio y television,morena,integrante,
1354,64,20181009,alta,15,MARIA DE LOS ANGELES HUERTA DEL RIO,mex24p,radio y television,morena,integrante,
1355,64,20181009,alta,16,MARIA MARIVEL SOLIS BARRERA,rp5-31s,radio y television,morena,integrante,
1356,64,20181009,alta,17,ZOE ALEJANDRO ROBLEDO ABURTO,cps06p,radio y television,morena,integrante,
1357,64,20181009,alta,18,MIGUEL PRADO DE LOS SANTOS,cps07p,radio y television,morena,integrante,
1358,64,20181009,alta,19,MARTINA CAZAREZ YAÑEZ,rp2-36p,radio y television,morena,integrante,
1359,64,20181009,alta,20,ARMANDO JAVIER ZERTUCHE ZUANI,tam09p,radio y television,morena,integrante,
1360,64,20181009,alta,21,MERARY VILLEGAS SANCHEZ,sin07p,radio y television,morena,integrante,
1361,64,20181009,alta,22,MARIA DE LOS ANGELES AYALA DIAZ,gua03p,radio y television,pan,integrante,
1362,64,20181009,alta,23,SVLVIA VIOLETA GARFIAS CEDILLO,rp2-06p,radio y television,pan,integrante,
1363,64,20181009,alta,24,PABLO GUILLERMO ANGULO BRICEÑO,rp3-12p,radio y television,pri,integrante,
1364,64,20181009,alta,25,NORMA ADELA GUEL SALDIVAR,rp2-22p,radio y television,pes,integrante,
1365,64,20181009,alta,26,HECTOR JOEL VILLEGAS GONZALEZ,tam03p,radio y television,pes,integrante,
1366,64,20181009,alta,27,SANTIAGO GONZALEZ SOTO,nl05p,radio y television,pt,integrante,
1367,64,20181009,alta,28,JORGE ALCIBIADES GARCIA LARA,rp1-22p,radio y television,mc,integrante,
1368,64,20181009,alta,29,MARCO ANTONIO GOMEZ ALCANTAR,rp1-19p,radio y television,pvem,integrante,
1369,64,20181018,baja,16,MARIA MARIVEL SOLIS BARRERA,rp5-31s,radio y television,morena,integrante,
1370,64,20181018,alta,16,IRAN SANTIAGO MANUEL,rp3-24p,radio y television,morena,integrante,
1371,64,20181018,baja,20,ARMANDO JAVIER ZERTUCHE ZUANI,tam09p,radio y television,morena,integrante,
1372,64,20181018,alta,20,PEDRO MARIO ZENTENO SANTAELLA,mex37p,radio y television,morena,integrante,
1373,64,20181106,baja,29,MARCO ANTONIO GOMEZ ALCANTAR,rp1-19p,radio y television,pvem,integrante,
1374,64,20181106,alta,29,ARTURO ESCOBAR Y VEGA,rp4-19p,radio y television,pvem,integrante,
1375,64,20181211,alta,30,RAUL EDUARDO BONIFAZ MOEDANO,cps06s,radio y television,morena,integrante,not listed 9oct
1376,64,20190227,alta,?,VICENTE ALBERTO ONOFRE VAZQUEZ,mex33p,radio y television,morena,integrante,
1377,64,20181009,alta,1,FELICIANO FLORES ANGUIANO,mic01p,recursos hidraulicos agua potable y saneamiento,morena,presidente,
1378,64,20181009,alta,2,CLAUDIA VALERIA YAÑEZ CENTENO Y CABRERA,col01p,recursos hidraulicos agua potable y saneamiento,morena,secretario,
1379,64,20181009,alta,3,CASIMIRO ZAMORA VALDEZ,sin04p,recursos hidraulicos agua potable y saneamiento,morena,secretario,
1380,64,20181009,alta,4,ROBERTO ANGEL DOMINGUEZ RODRIGUEZ,mex28p,recursos hidraulicos agua potable y saneamiento,morena,secretario,
1381,64,20181009,alta,5,LETICIA DIAZ AGUILAR,rp4-27p,recursos hidraulicos agua potable y saneamiento,morena,secretario,
1382,64,20181009,alta,6,JESUS SALVADOR MINOR MORA,bc01p,recursos hidraulicos agua potable y saneamiento,morena,secretario,
1383,64,20181009,alta,7,VALENTIN REYES LOPEZ,ver17p,recursos hidraulicos agua potable y saneamiento,morena,secretario,
1384,64,20181009,alta,8,NOHEMI ALEMAN HERNANDEZ,rp2-08p,recursos hidraulicos agua potable y saneamiento,pan,secretario,
1385,64,20181009,alta,9,XAVIER AZUARA ZUÑIGA,rp2-09p,recursos hidraulicos agua potable y saneamiento,pan,secretario,
1386,64,20181009,alta,10,LOURDES ERIKA SANCHEZ MARTINEZ,rp1-10p,recursos hidraulicos agua potable y saneamiento,pri,secretario,
1387,64,20181009,alta,11,JUAN FRANCISCO ESPINOZA EGUIA,nl09p,recursos hidraulicos agua potable y saneamiento,pri,secretario,
1388,64,20181009,alta,12,HECTOR JOEL VILLEGAS GONZALEZ,tam03p,recursos hidraulicos agua potable y saneamiento,pes,secretario,
1389,64,20181009,alta,13,ALFREDO PORRAS DOMINGUEZ,bcs02p,recursos hidraulicos agua potable y saneamiento,pt,secretario,
1390,64,20181009,alta,14,MARIO ALBERTO RAMOS TAMEZ,tam05p,recursos hidraulicos agua potable y saneamiento,mc,secretario,
1391,64,20181009,alta,15,ANTONIO ORTEGA MARTINEZ,rp2-24p,recursos hidraulicos agua potable y saneamiento,prd,secretario,
1392,64,20181009,alta,16,OSCAR BAUTISTA VILLEGAS,san03p,recursos hidraulicos agua potable y saneamiento,pvem,secretario,
1393,64,20181009,alta,17,FRANCISCO JAVIER BORREGO ADAME,coa02p,recursos hidraulicos agua potable y saneamiento,morena,integrante,
1394,64,20181009,alta,18,JULIO CARRANZA AREAS,rp3-26p,recursos hidraulicos agua potable y saneamiento,morena,integrante,
1395,64,20181009,alta,19,ARMANDO CONTRERAS CASTILLO,rp3-36p,recursos hidraulicos agua potable y saneamiento,morena,integrante,
1396,64,20181009,alta,20,MARIA BERTHA ESPINOZA SEGURA,ver03p,recursos hidraulicos agua potable y saneamiento,morena,integrante,
1397,64,20181009,alta,21,BENJAMIN SAUL HUERTA CORONA,pue11p,recursos hidraulicos agua potable y saneamiento,morena,integrante,
1398,64,20181009,alta,22,LORENA DEL SOCORRO JIMENEZ ANDRADE,jal05p,recursos hidraulicos agua potable y saneamiento,morena,integrante,
1399,64,20181009,alta,23,ALMA DELIA NAVARRETE RIVERA,mex10p,recursos hidraulicos agua potable y saneamiento,morena,integrante,
1400,64,20181009,alta,24,SERGIO PEREZ HERNANDEZ,rp5-30p,recursos hidraulicos agua potable y saneamiento,morena,integrante,
1401,64,20181009,alta,25,ANA MARIA RODRIGUEZ RUIZ,df18p,recursos hidraulicos agua potable y saneamiento,morena,integrante,
1402,64,20181009,alta,26,BEATRIZ ROJAS MARTINEZ,df07p,recursos hidraulicos agua potable y saneamiento,morena,integrante,
1403,64,20181009,alta,27,MARIO MATA CARRASCO,cua05p,recursos hidraulicos agua potable y saneamiento,pan,integrante,
1404,64,20181009,alta,28,RICARDO FLORES SUAREZ,nl04p,recursos hidraulicos agua potable y saneamiento,pan,integrante,
1405,64,20181009,alta,29,JESUS GUZMAN AVILES,ver02p,recursos hidraulicos agua potable y saneamiento,pan,integrante,
1406,64,20181009,alta,30,LENIN NELSON CAMPOS CORDOVA,rp2-21p,recursos hidraulicos agua potable y saneamiento,pri,integrante,
1407,64,20181009,alta,31,FRANCISCO JAVIER SALDIVAR CAMACHO,df17p,recursos hidraulicos agua potable y saneamiento,pes,integrante,
1408,64,20181009,alta,32,ANA RUTH GARCIA GRANDE,bcs01p,recursos hidraulicos agua potable y saneamiento,pt,integrante,
1409,64,20181009,alta,33,vacant,.,recursos hidraulicos agua potable y saneamiento,mc,integrante,
1410,64,20181018,baja,32,ANA RUTH GARCIA GRANDE,bcs01p,recursos hidraulicos agua potable y saneamiento,pt,integrante,
1411,64,20181018,alta,32,ANA KARINA ROJO PIMENTEL,df20p,recursos hidraulicos agua potable y saneamiento,pt,integrante,
1412,64,20181018,alta,33,ADRIANA GABRIELA MEDINA ORTIZ,jal12p,recursos hidraulicos agua potable y saneamiento,mc,integrante,
1413,64,20181018,alta,34,ANTONIO ORTEGA MARTINEZ,rp2-24p,recursos hidraulicos agua potable y saneamiento,prd,integrante,vacancy not listed 9oct
1414,64,20181018,alta,35,DAVID ORIHUELA NAVA,mex23p,recursos hidraulicos agua potable y saneamiento,morena,integrante,vacancy not listed 9oct
1415,64,20181022,baja,15,ANTONIO ORTEGA MARTINEZ,rp2-24p,recursos hidraulicos agua potable y saneamiento,prd,secretario,
1416,64,20181022,alta,15,ANTONIO ORTEGA MARTINEZ,rp2-24p,recursos hidraulicos agua potable y saneamiento,prd,integrante,
1417,64,20181022,alta,15,JAVIER SALINAS NARVAEZ,rp5-17p,recursos hidraulicos agua potable y saneamiento,prd,secretario,
1418,64,20190115,baja,9,XAVIER AZUARA ZUÑIGA,rp2-09p,recursos hidraulicos agua potable y saneamiento,pan,integrante,
1419,64,20190115,alta,9,ADRIAN SANCHEZ RAMIRO,rp2-09s,recursos hidraulicos agua potable y saneamiento,pan,integrante,
1420,64,20190117,baja,9,ADRIAN SANCHEZ RAMIRO,rp2-09s,recursos hidraulicos agua potable y saneamiento,pan,integrante,
1421,64,20190117,alta,9,XAVIER AZUARA ZUÑIGA,rp2-09p,recursos hidraulicos agua potable y saneamiento,pan,integrante,
1422,64,20190426,baja,32,ANA KARINA ROJO PIMENTEL,df20p,recursos hidraulicos agua potable y saneamiento,pt,integrante,
1423,64,20190426,alta,32,ANA RUTH GARCIA GRANDE,bcs01p,recursos hidraulicos agua potable y saneamiento,pt,integrante,
1424,64,20181009,alta,1,JORGE LUIS PRECIADO RODRIGUEZ,rp5-03p,regimen reglamentos y practicas parlamentarias,pan,presidente,
1425,64,20181009,alta,2,JUAN ANGEL BAUTISTA BRAVO,mex31p,regimen reglamentos y practicas parlamentarias,morena,secretario,
1426,64,20181009,alta,3,vacant,.,regimen reglamentos y practicas parlamentarias,morena,secretario,
1427,64,20181009,alta,4,vacant,.,regimen reglamentos y practicas parlamentarias,morena,secretario,
1428,64,20181009,alta,5,MARCOS AGUILAR VEGA,rp2-05p,regimen reglamentos y practicas parlamentarias,pan,secretario,
1429,64,20181009,alta,6,CLAUDIA PASTOR BADILLA,rp4-13p,regimen reglamentos y practicas parlamentarias,pri,secretario,
1430,64,20181009,alta,7,MARTHA PATRICIA RAMIREZ LUCERO,rp1-39p,regimen reglamentos y practicas parlamentarias,morena,integrante,
1431,64,20181009,alta,8,ROCIO BARRERA BADILLO,df11p,regimen reglamentos y practicas parlamentarias,morena,integrante,
1432,64,20181009,alta,9,LIDIA NALLELY VARGAS HERNANDEZ,rp2-32p,regimen reglamentos y practicas parlamentarias,morena,integrante,
1433,64,20181009,alta,10,MIROSLAVA SANCHEZ GALVAN,rp2-34p,regimen reglamentos y practicas parlamentarias,morena,integrante,
1434,64,20181009,alta,11,CUAUHTLI FERNANDO BADILLO MORENO,rp2-37p,regimen reglamentos y practicas parlamentarias,morena,integrante,
1435,64,20181009,alta,12,JORGE LUIS MONTES NIEVES,que02p,regimen reglamentos y practicas parlamentarias,morena,integrante,
1436,64,20181009,alta,13,JOSE GUADALUPE AMBROCIO GACHUZ,mor05p,regimen reglamentos y practicas parlamentarias,morena,integrante,
1437,64,20181009,alta,14,JORGE ARTURO ESPADAS GALVAN,gua11p,regimen reglamentos y practicas parlamentarias,pan,integrante,
1438,64,20181009,alta,15,IVONNE LILIANA ALVAREZ GARCIA,rp2-14p,regimen reglamentos y practicas parlamentarias,pri,integrante,
1439,64,20181009,alta,16,JOSE DE LA LUZ SOSA SALINAS,tla01p,regimen reglamentos y practicas parlamentarias,pes,integrante,
1440,64,20181009,alta,17,vacant,.,regimen reglamentos y practicas parlamentarias,pt,integrante,
1441,64,20181009,alta,18,ITZCOATL TONATIUH BRAVO PADILLA,rp1-20p,regimen reglamentos y practicas parlamentarias,mc,integrante,
1442,64,20181009,alta,19,vacant,.,regimen reglamentos y practicas parlamentarias,prd,integrante,
1443,64,20181009,alta,20,vacant,.,regimen reglamentos y practicas parlamentarias,pvem,integrante,
1444,64,20181011,alta,19,LUZ ESTEFANIA ROSAS MARTINEZ,rp4-18p,regimen reglamentos y practicas parlamentarias,prd,integrante,
1445,64,20181018,alta,17,SILVANO GARAY ULLOA,rp3-18s,regimen reglamentos y practicas parlamentarias,pt,integrante,
1446,64,20181018,baja,18,ITZCOATL TONATIUH BRAVO PADILLA,rp1-20p,regimen reglamentos y practicas parlamentarias,mc,integrante,
1447,64,20181018,alta,18,JUAN CARLOS VILLARREAL SALAZAR,jal07p,regimen reglamentos y practicas parlamentarias,mc,,
1448,64,20181106,alta,20,MARCO ANTONIO GOMEZ ALCANTAR,rp1-19p,regimen reglamentos y practicas parlamentarias,pvem,integrante,
1449,64,20181120,baja,20,MARCO ANTONIO GOMEZ ALCANTAR,rp1-19p,regimen reglamentos y practicas parlamentarias,pvem,integrante,
1450,64,20181120,alta,20,vacant,.,regimen reglamentos y practicas parlamentarias,pvem,integrante,
1451,64,20181211,alta,3,EDGAR EDUARDO ARENAS MADRIGAL,mex37s,regimen reglamentos y practicas parlamentarias,morena,secretario,
1452,64,20181009,alta,1,ALFREDO FEMAT BAÑUELOS,zac03p,relaciones exteriores,pt,presidente,
1453,64,20181009,alta,2,MARIA DEL CARMEN BAUTISTA PELAEZ,oax09p,relaciones exteriores,morena,secretario,
1454,64,20181009,alta,3,GABRIELA CUEVAS BARRON,rp4-29p,relaciones exteriores,morena,secretario,
1455,64,20181009,alta,4,BEATRIZ SILVIA ROBLES GUTIERREZ,que03p,relaciones exteriores,morena,secretario,
1456,64,20181009,alta,5,MIRIAM CITLALLY PEREZ MACKINTOSH,rp1-33p,relaciones exteriores,morena,secretario,
1457,64,20181009,alta,6,TERESITA DE JESUS VARGAS MERAZ,cua02p,relaciones exteriores,morena,secretario,
1458,64,20181009,alta,7,SARAI NUÑEZ CERON,gua12p,relaciones exteriores,pan,secretario,
1459,64,20181009,alta,8,HORTENSIA MARIA LUISA NOROÑA QUEZADA,rp1-14p,relaciones exteriores,pri,secretario,
1460,64,20181009,alta,9,CLAUDIA ANGELICA DOMINGUEZ VAZQUEZ,mex14p,relaciones exteriores,pt,secretario,
1461,64,20181009,alta,10,MONICA BAUTISTA RODRIGUEZ,rp5-16p,relaciones exteriores,prd,secretario,
1462,64,20181009,alta,11,JORGE EMILIO GONZALEZ MARTINEZ,rp3-19p,relaciones exteriores,pvem,secretario,
1463,64,20181009,alta,12,JOSE LUIS ELORZA FLORES,cps12p,relaciones exteriores,morena,integrante,
1464,64,20181009,alta,13,MARIA EUGENIA HERNANDEZ PEREZ,mex11p,relaciones exteriores,morena,integrante,
1465,64,20181009,alta,14,MIRNA ZABEIDA MALDONADO TAPIA,zac01p,relaciones exteriores,morena,integrante,
1466,64,20181009,alta,15,ANA PATRICIA PERALTA DE LA PEÑA,rp3-20p,relaciones exteriores,morena,integrante,
1467,64,20181009,alta,16,LAURA IMELDA PEREZ SEGURA,jal16p,relaciones exteriores,morena,integrante,
1468,64,20181009,alta,17,MARIA GERALDINE PONCE MENDEZ,nay02p,relaciones exteriores,morena,integrante,
1469,64,20181009,alta,18,CIRO SALES RUIZ,rp3-32p,relaciones exteriores,morena,integrante,
1470,64,20181009,alta,19,LORENIA IVETH VALLES SAMPEDRO,son03p,relaciones exteriores,morena,integrante,
1471,64,20181009,alta,20,ALBERTO VILLA VILLEGAS,rp1-34p,relaciones exteriores,morena,integrante,
1472,64,20181009,alta,21,MIRTHA ILIANA VILLALVAZO AMAVA,nay03p,relaciones exteriores,morena,integrante,
1473,64,20181009,alta,22,ALMA MARINA VITELA RODRIGUEZ,dgo02p,relaciones exteriores,morena,integrante,
1474,64,20181009,alta,23,XOCHITL NASHIELLY ZAGAL RAMIREZ,mex07p,relaciones exteriores,morena,integrante,
1475,64,20181009,alta,24,ANNIA SARAHI GOMEZ CARDENAS,nl06p,relaciones exteriores,pan,integrante,
1476,64,20181009,alta,25,LIZBETH MATA LOZANO,rp1-07p,relaciones exteriores,pan,integrante,
1477,64,20181009,alta,26,OSCAR DANIEL MARTINEZ TERRAZAS,rp4-08p,relaciones exteriores,pan,integrante,
1478,64,20181009,alta,27,LAURA ANGELICA ROJAS HERNANDEZ,rp5-02p,relaciones exteriores,pan,integrante,
1479,64,20181009,alta,28,HECTOR YUNES LANDA,rp3-10p,relaciones exteriores,pri,integrante,
1480,64,20181009,alta,29,BENITO MEDINA HERRERA,rp1-09p,relaciones exteriores,pri,integrante,
1481,64,20181009,alta,30,CLAUDIA BAEZ RUIZ,pue03p,relaciones exteriores,pes,integrante,
1482,64,20181009,alta,31,OLGA JULIANA ELIZONDO GUERRA,tam02p,relaciones exteriores,pes,integrante,
1483,64,20181009,alta,32,MARIA LIBIER GONZALEZ ANAYA,rp1-23p,relaciones exteriores,mc,integrante,
1484,64,20181009,alta,33,MARIA DEL PILAR LOZANO MAC DONALD,rp2-28p,relaciones exteriores,mc,integrante,
1485,64,20181206,baja,11,JORGE EMILIO GONZALEZ MARTINEZ,rp3-19p,relaciones exteriores,pvem,secretario,
1486,64,20181206,alta,11,CARLOS ALBERTO PUENTE SALAS,rp2-25p,relaciones exteriores,pvem,secretario,
1487,64,20181211,alta,34,CLAUDIA PEREZ RODRIGUEZ,tla03s,relaciones exteriores,morena,integrante,not listed 9oct
1488,64,20190213,baja,11,CARLOS ALBERTO PUENTE SALAS,rp2-25p,relaciones exteriores,pvem,secretario,
1489,64,20190213,alta,11,ARTURO ESCOBAR Y VEGA,rp4-19p,relaciones exteriores,pvem,secretario,
1490,64,20190301,baja,22,ALMA MARINA VITELA RODRIGUEZ,dgo02p,relaciones exteriores,morena,integrante,
1491,64,20190301,alta,22,vacant,.,relaciones exteriores,morena,integrante,
1492,64,20190314,baja,22,vacant,.,relaciones exteriores,morena,integrante,
1493,64,20190314,alta,22,MARIA DE LOURDES MONTES HERNANDEZ,dgo02s,relaciones exteriores,morena,integrante,
1494,64,2019..,baja,10,MONICA BAUTISTA RODRIGUEZ,rp5-16p,relaciones exteriores,prd,secretario,
1495,64,2019..,alta,10,vacant,.,relaciones exteriores,prd,secretario,
1496,64,20190408,baja,10,vacant,.,relaciones exteriores,prd,secretario,
1497,64,20190408,alta,10,MONICA BAUTISTA RODRIGUEZ,rp5-16p,relaciones exteriores,prd,secretario,
1498,64,20190430,baja,11,ARTURO ESCOBAR Y VEGA,rp4-19p,relaciones exteriores,pvem,secretario,
1499,64,20190430,alta,11,JORGE FRANCISCO CORONA MENDEZ,rp3-19s,relaciones exteriores,pvem,secretario,
1500,64,20181009,alta,1,MIROSLAVA SANCHEZ GALVAN,rp2-34p,salud,morena,presidente,
1501,64,20181009,alta,2,ALEJANDRO BARROSO CHAVEZ,pue15p,salud,morena,secretario,
1502,64,20181009,alta,3,ARTURO ROBERTO HERNANDEZ TAPIA,mex35p,salud,morena,secretario,
1503,64,20181009,alta,4,MANUEL HUERTA MARTINEZ,rp4-34p,salud,morena,secretario,
1504,64,20181009,alta,5,CARMEN MEDEL PALMA,ver14p,salud,morena,secretario,
1505,64,20181009,alta,6,ALMA MARINA VITELA RODRIGUEZ,dgo02p,salud,morena,secretario,
1506,64,20181009,alta,7,ANA PATRICIA PERALTA DE LA PEÑA,rp3-20p,salud,morena,secretario,
1507,64,20181009,alta,8,VICTOR ADOLFO MOJICA WENCES,mex33p,salud,morena,secretario,
1508,64,20181009,alta,9,MARTHA ESTELA ROMO CUELLAR,jal02p,salud,pan,secretario,
1509,64,20181009,alta,10,ECTOR JAIME RAMIREZ BARBA,gua05p,salud,pan,secretario,
1510,64,20181009,alta,11,FRINNE AZUARA YARZABAL,rp2-18p,salud,pri,secretario,
1511,64,20181009,alta,12,ELBA LORENA TORRES DIAZ,ags02p,salud,pes,secretario,
1512,64,20181009,alta,13,FRANCISCO FAVELA PEÑUÑURI,mex05p,salud,pt,secretario,
